{
  "benchmark_results": [
    {
      "benchmark_id": "json-health-checker-template-pack-smoke-small-001",
      "latest_run_id": "json-health-checker-promotion-gate-build-pack-v1-active-task-continuity-run-v1",
      "run_artifact_path": "eval/history/import-external-runtime-evidence-20260325t163240z/external-runtime-evidence/artifacts/run-summary.json",
      "status": "pass",
      "summary_artifact_path": "eval/history/import-external-runtime-evidence-20260325t163240z/external-runtime-evidence/artifacts/run-summary.json"
    }
  ],
  "pack_id": "json-health-checker-promotion-gate-build-pack-v1",
  "pack_kind": "build_pack",
  "schema_version": "pack-eval-index/v1",
  "updated_at": "2026-03-25T16:32:40Z"
}
