{
  "benchmark_results": [
    {
      "benchmark_id": "algosec-diagnostic-framework-template-pack-smoke-small-001",
      "latest_run_id": "readiness-eval-algosec-diagnostic-framework-build-pack-v1-benchmark-20260326t145300z",
      "run_artifact_path": "eval/history/readiness-eval-algosec-diagnostic-framework-build-pack-v1-benchmark-20260326t145300z/benchmark-result.json",
      "status": "pass",
      "summary_artifact_path": "eval/history/readiness-eval-algosec-diagnostic-framework-build-pack-v1-benchmark-20260326t145300z/benchmark-result.json"
    }
  ],
  "pack_id": "algosec-diagnostic-framework-build-pack-v1",
  "pack_kind": "build_pack",
  "schema_version": "pack-eval-index/v1",
  "updated_at": "2026-03-28T19:35:10Z"
}
