{
  "benchmark_results": [
    {
      "benchmark_id": "api-contract-sentinel-template-pack-smoke-small-001",
      "latest_run_id": "multi-hop-autonomy-rehearsal-api-contract-autonomy-transfer-build-pack-v1-20260325t231545z-benchmark-refresh",
      "run_artifact_path": "eval/history/multi-hop-autonomy-rehearsal-api-contract-autonomy-transfer-build-pack-v1-20260325t231545z-benchmark-refresh/benchmark-result.json",
      "status": "pass",
      "summary_artifact_path": "eval/history/multi-hop-autonomy-rehearsal-api-contract-autonomy-transfer-build-pack-v1-20260325t231545z-benchmark-refresh/benchmark-result.json"
    }
  ],
  "pack_id": "api-contract-autonomy-transfer-build-pack-v1",
  "pack_kind": "build_pack",
  "schema_version": "pack-eval-index/v1",
  "updated_at": "2026-03-25T23:15:58Z"
}
